{
  "meta": {
    "artifact_name": "workflow_execution_log",
    "artifact_version": "0.1.0",
    "validation_extension": "Validation Extension B",
    "schema_draft": "2020-12",
    "brief_id": "brief_demo_action_camera_001",
    "workflow_version": "V2",
    "project_name": "E-commerce Growth Agent Studio",
    "project_name_cn": "电商增长 Agent 工作台",
    "status": "pass",
    "log_type": "retrospective_artifact_derived_log",
    "telemetry_type": "not_runtime_telemetry",
    "log_build_started_at": "2026-07-16T07:38:49.399Z",
    "log_build_completed_at": "2026-07-16T07:38:49.400Z",
    "log_build_duration_ms": 1,
    "log_generated_at": "2026-07-16T07:38:49.400Z",
    "builder_script": "scripts/build_workflow_execution_log.mjs",
    "builder_exit_code": 0
  },
  "workflow_summary": {
    "covered_steps": [
      1,
      2,
      3,
      4,
      5,
      6,
      7,
      8,
      9,
      10,
      11,
      12,
      13,
      14,
      15
    ],
    "node_count": 15,
    "timing_policy": "Steps 1-15 are historical nodes; node-level timing is unavailable and must remain null with historical_not_available evidence.",
    "steps_1_to_15_rerun": false,
    "input_file_checks": {
      "total": 81,
      "passed": 81,
      "failed": 0
    },
    "output_file_checks": {
      "total": 30,
      "passed": 30,
      "failed": 0
    },
    "historical_not_available_node_count": 15,
    "measured_node_time_count": 0
  },
  "nodes": [
    {
      "step": 1,
      "node_id": "step_01_standard_product_brief_input",
      "node_name": "Standard Product Brief Input",
      "node_type": "input_artifact",
      "execution_status": "historical_completed",
      "execution_status_source": "PROJECT_MEMORY_FOR_OPENCLAW.md Progress: Step 1-8 已完成；README 当前进度",
      "governance_status": "needs_review",
      "governance_status_source": "workflow/agent_workflow.md 输入与前置校验；schemas/product_brief.schema.json 约束；后续节点继承 needs_review",
      "input_files": [
        {
          "path": "docs/product_brief_input_template.md",
          "exists": true
        }
      ],
      "output_files": [
        {
          "path": "data/sample_brief.json",
          "exists": true
        }
      ],
      "missing_input_files": [],
      "missing_output_files": [],
      "started_at": null,
      "completed_at": null,
      "duration_ms": null,
      "timing_evidence_type": "historical_not_available",
      "timestamp_source": "none",
      "release_gate_effect": {
        "changes_release_gates": false,
        "blocked_gates_preserved": true,
        "notes": "No final generation release; blocked gates unchanged."
      }
    },
    {
      "step": 2,
      "node_id": "step_02_workflow_schema_io_contract_specification",
      "node_name": "Workflow / Schema / I/O Contract Specification",
      "node_type": "specification",
      "execution_status": "historical_completed",
      "execution_status_source": "PROJECT_MEMORY_FOR_OPENCLAW.md Progress: Step 1-8 已完成；workflow/agent_io_contracts.md",
      "governance_status": "not_applicable",
      "governance_status_source": "workflow/agent_io_contracts.md 通用契约 and status rules",
      "input_files": [
        {
          "path": "data/sample_brief.json",
          "exists": true
        }
      ],
      "output_files": [
        {
          "path": "schemas/product_brief.schema.json",
          "exists": true
        },
        {
          "path": "workflow/agent_workflow.md",
          "exists": true
        },
        {
          "path": "workflow/agent_io_contracts.md",
          "exists": true
        }
      ],
      "missing_input_files": [],
      "missing_output_files": [],
      "started_at": null,
      "completed_at": null,
      "duration_ms": null,
      "timing_evidence_type": "historical_not_available",
      "timestamp_source": "none",
      "release_gate_effect": {
        "changes_release_gates": false,
        "blocked_gates_preserved": true,
        "notes": "Defines status and workflow rules only; blocked gates unchanged."
      }
    },
    {
      "step": 3,
      "node_id": "step_03_brief_parser_agent",
      "node_name": "Brief Parser Agent",
      "node_type": "agent",
      "execution_status": "historical_completed",
      "execution_status_source": "PROJECT_MEMORY_FOR_OPENCLAW.md Progress: Step 1-8 已完成；outputs/v2_final_report.json artifact_index.v1_artifacts[Brief Parser Agent]",
      "governance_status": "needs_review",
      "governance_status_source": "outputs/v2_final_report.json artifact_index.v1_artifacts: outputs/standardized_brief_summary.json status=needs_review",
      "input_files": [
        {
          "path": "data/sample_brief.json",
          "exists": true
        },
        {
          "path": "schemas/product_brief.schema.json",
          "exists": true
        },
        {
          "path": "prompts/brief_parser.md",
          "exists": true
        }
      ],
      "output_files": [
        {
          "path": "outputs/standardized_brief_summary.json",
          "exists": true
        },
        {
          "path": "outputs/brief_parser_report.md",
          "exists": true
        }
      ],
      "missing_input_files": [],
      "missing_output_files": [],
      "started_at": null,
      "completed_at": null,
      "duration_ms": null,
      "timing_evidence_type": "historical_not_available",
      "timestamp_source": "none",
      "release_gate_effect": {
        "changes_release_gates": false,
        "blocked_gates_preserved": true,
        "notes": "No release permission; downstream review state preserved."
      }
    },
    {
      "step": 4,
      "node_id": "step_04_audience_insight_skill",
      "node_name": "Audience Insight Skill",
      "node_type": "skill",
      "execution_status": "historical_completed",
      "execution_status_source": "PROJECT_MEMORY_FOR_OPENCLAW.md Progress: Step 1-8 已完成；outputs/v2_final_report.json artifact_index.v1_artifacts[Audience Insight Skill]",
      "governance_status": "needs_review",
      "governance_status_source": "outputs/v2_final_report.json artifact_index.v1_artifacts: outputs/audience_insight.json status=needs_review",
      "input_files": [
        {
          "path": "data/sample_brief.json",
          "exists": true
        },
        {
          "path": "outputs/standardized_brief_summary.json",
          "exists": true
        },
        {
          "path": "prompts/audience_insight.md",
          "exists": true
        }
      ],
      "output_files": [
        {
          "path": "outputs/audience_insight.json",
          "exists": true
        },
        {
          "path": "outputs/audience_insight_report.md",
          "exists": true
        }
      ],
      "missing_input_files": [],
      "missing_output_files": [],
      "started_at": null,
      "completed_at": null,
      "duration_ms": null,
      "timing_evidence_type": "historical_not_available",
      "timestamp_source": "none",
      "release_gate_effect": {
        "changes_release_gates": false,
        "blocked_gates_preserved": true,
        "notes": "No release permission; downstream review state preserved."
      }
    },
    {
      "step": 5,
      "node_id": "step_05_selling_point_analyst_agent",
      "node_name": "Selling Point Analyst Agent",
      "node_type": "agent",
      "execution_status": "historical_completed",
      "execution_status_source": "PROJECT_MEMORY_FOR_OPENCLAW.md Progress: Step 1-8 已完成；outputs/v2_final_report.json artifact_index.v1_artifacts[Selling Point Analyst Agent]",
      "governance_status": "needs_review",
      "governance_status_source": "outputs/v2_final_report.json artifact_index.v1_artifacts: outputs/selling_point_matrix.json status=needs_review",
      "input_files": [
        {
          "path": "data/sample_brief.json",
          "exists": true
        },
        {
          "path": "outputs/standardized_brief_summary.json",
          "exists": true
        },
        {
          "path": "outputs/audience_insight.json",
          "exists": true
        },
        {
          "path": "prompts/selling_point_analyst.md",
          "exists": true
        }
      ],
      "output_files": [
        {
          "path": "outputs/selling_point_matrix.json",
          "exists": true
        },
        {
          "path": "outputs/selling_point_matrix.md",
          "exists": true
        }
      ],
      "missing_input_files": [],
      "missing_output_files": [],
      "started_at": null,
      "completed_at": null,
      "duration_ms": null,
      "timing_evidence_type": "historical_not_available",
      "timestamp_source": "none",
      "release_gate_effect": {
        "changes_release_gates": false,
        "blocked_gates_preserved": true,
        "notes": "Unsupported claims remain review-gated; blocked gates unchanged."
      }
    },
    {
      "step": 6,
      "node_id": "step_06_platform_strategy_skill",
      "node_name": "Platform Strategy Skill",
      "node_type": "skill",
      "execution_status": "historical_completed",
      "execution_status_source": "PROJECT_MEMORY_FOR_OPENCLAW.md Progress: Step 1-8 已完成；outputs/v2_final_report.json artifact_index.v1_artifacts[Platform Strategy Skill]",
      "governance_status": "needs_review",
      "governance_status_source": "outputs/v2_final_report.json artifact_index.v1_artifacts: outputs/platform_strategy_plan.json status=needs_review",
      "input_files": [
        {
          "path": "data/sample_brief.json",
          "exists": true
        },
        {
          "path": "outputs/standardized_brief_summary.json",
          "exists": true
        },
        {
          "path": "outputs/audience_insight.json",
          "exists": true
        },
        {
          "path": "outputs/selling_point_matrix.json",
          "exists": true
        },
        {
          "path": "prompts/platform_strategy.md",
          "exists": true
        }
      ],
      "output_files": [
        {